### ISSUE TITLE
explicitly set source IP of outbound UDP packets

### ISSUE THREAD

**Issue by RouquinBlanc** [bluenviron/gortsplib#1059]
Hi,

I encountered an annoyance more than a real issue having an RTSP client trying to talk to an RTSP server running on the same host via the local network. The problem is interesting.

The client is configured to connect to `rtsp://myhostname:8554/stream` which on ubuntu is often configured in /etc/hosts as

```
127.0.0.1 localhost
127.0.1.1 myhostname
```

The control TCP connection is established on 127.0.1.1 (for the server IP) and from 127.0.0.1 (source address selected):

- On the server side, the server sees `127.0.0.1` as the client IP and will send UDP packets back to that IP
- On the client side, it registers the `udpRTPListener.readIP` as the remote, ie `127.0.1.1`.

Packets are then sent back by the server, but the source address selection mechanism selects `127.0.0.1` as the source IP for sending packets toward (also) `127.0.0.1`.

```
07:32:15.705083 IP 127.0.0.1.8000 > 127.0.0.1.50646: UDP, length 1440
07:32:15.705195 IP 127.0.0.1.8000 > 127.0.0.1.50646: UDP, length 1440
07:32:15.705359 IP 127.0.0.1.8000 > 127.0.0.1.50646: UDP, length 1440
07:32:15.705510 IP 127.0.0.1.8000 > 127.0.0.1.50646: UDP, length 1440
07:32:15.705583 IP 127.0.0.1.8000 > 127.0.0.1.50646: UDP, length 1440
07:32:15.705681 IP 127.0.0.1.8000 > 127.0.0.1.50646: UDP, length 1440
```

On the client side, the reception loop then drops packets:

```
	for {
		n, addr, err := u.pc.ReadFrom(buf)
		if err != nil {
			return
		}

		uaddr := addr.(*net.UDPAddr)

		if !u.readIP.Equal(uaddr.IP) { // <<<<<< readIP is 127.0.1.1, uaddr.IP is 127.0.0.1
			continue
		}
```

While it is trivial to fix the issue in config (either changing the /etc/hosts or simply connecting to the server with localhost instead of the hostname), and the TCP fallback eventually triggers, it introduces an unpleasant 3 seconds timeout, and I'm pretty sure the issue will happen again in the future.

I'm wondering, when `readIP` is a loopback address, if the check in the reception loop could accept packets from any other loopback address instead of a strict IP match? Could it be a security breach? Isn't the `readPort` check enough?

Best regards

**Comment by aler9** [comment]
Hello,
First of all i'm assuming both client and server are based on gortsplib, and you are trying to play a stream from the server. These details are unspecified and should have been provided.

The proper solution is to improve the server in order to detect the destination IP of inbound packets, and use that as source IP of outbound packets. Something similar has been done with the SRT protocol, in https://github.com/datarhei/gosrt/pull/136

**Comment by RouquinBlanc** [comment]
Hi,

Yes you are correct, both using gortsplib, sorry.
